{
  "$schema": "https://json-schema.org/draft/2020-12/schema",
  "$id": "https://github.com/MichaelWave369/FieldAccord/contract/v0.1/action-proposal",
  "title": "ActionProposal FA-01",
  "type": "object",
  "additionalProperties": false,
  "required": [
    "schema",
    "proposal_id",
    "work_id",
    "capability_id",
    "action",
    "resource",
    "payload_sha256",
    "evidence_refs"
  ],
  "properties": {
    "schema": {
      "const": "fa.action_proposal.v0.1"
    },
    "proposal_id": {
      "type": "string",
      "format": "uuid"
    },
    "work_id": {
      "type": "string",
      "format": "uuid"
    },
    "capability_id": {
      "type": "string",
      "pattern": "^[a-z][a-z0-9]*(?:[._-][a-z0-9]+)*$"
    },
    "action": {
      "type": "string",
      "pattern": "^[a-z][a-z0-9]*(?:[._-][a-z0-9]+)*$"
    },
    "resource": {
      "type": "string",
      "minLength": 1,
      "maxLength": 512
    },
    "payload_sha256": {
      "type": "string",
      "pattern": "^[0-9a-f]{64}$"
    },
    "evidence_refs": {
      "type": "array",
      "maxItems": 32,
      "uniqueItems": true,
      "items": {
        "type": "string",
        "minLength": 1,
        "maxLength": 512
      }
    }
  }
}
